{
  "$schema": "http://json-schema.org/draft-07/schema#",
  "title": "Brand pack",
  "description": "One brand: names and copy, logo files, colours, font pair and product categories. See docs/11-white-label.md.",
  "type": "object",
  "required": ["id", "name", "domain", "tagline", "taglineLines", "descriptor", "description", "legalEntity", "supportEmail", "minimumAge", "fonts", "logo", "categories", "themeColor", "theme"],
  "properties": {
    "$schema": { "type": "string" },
    "id": { "type": "string", "pattern": "^[a-z0-9-]{2,32}$", "description": "Same as the folder name. Select it with NEXT_PUBLIC_BRAND." },
    "name": { "type": "string", "description": "Brand name shown everywhere (header, titles, emails)." },
    "domain": { "type": "string", "description": "Public domain, e.g. grailnoir.com." },
    "tagline": { "type": "string", "description": "Slogan in one line (page titles, sign-in panel)." },
    "taglineLines": { "type": "array", "items": { "type": "string" }, "minItems": 1, "maxItems": 2, "description": "The slogan as two lines: setup, then the large gold punchline (footer)." },
    "descriptor": { "type": "string", "description": "Short line under the finale on the home page." },
    "sideline": { "type": "string", "description": "Words printed on the side of the 3D box." },
    "description": { "type": "string", "description": "One or two sentences: what you sell and how it works (footer, search engines)." },
    "legalEntity": { "type": "string", "description": "Company name in the copyright line." },
    "supportEmail": { "type": "string", "format": "email" },
    "minimumAge": { "type": "integer", "minimum": 18 },
    "market": { "type": "string" },
    "fonts": { "enum": ["inscription", "editorial", "modern"], "description": "inscription = Cinzel + Jost (engraved capitals), editorial = Playfair Display + Source Sans 3, modern = Sora + Manrope." },
    "logo": {
      "type": "object",
      "required": ["mark", "markWidth", "markHeight", "icon", "appleIcon"],
      "properties": {
        "mark": { "type": "string", "description": "Logo symbol on a transparent background (webp or png), in this folder." },
        "markWidth": { "type": "integer", "description": "Pixel width of the mark file." },
        "markHeight": { "type": "integer", "description": "Pixel height of the mark file." },
        "lockup": { "type": "string", "description": "Optional full logo (symbol + name) for the footer. Falls back to the mark." },
        "lockupWidth": { "type": "integer" },
        "lockupHeight": { "type": "integer" },
        "icon": { "type": "string", "description": "Browser tab icon, square PNG (e.g. 512×512)." },
        "appleIcon": { "type": "string", "description": "Home-screen icon, square PNG 180×180." },
        "silhouette": {
          "type": "object",
          "description": "Optional one-colour outline of the mark as an SVG path, for dark ink on light box finishes. Without it the mark's shape is used as a mask.",
          "required": ["viewBox", "path"],
          "properties": { "viewBox": { "type": "string" }, "path": { "type": "string" } }
        }
      }
    },
    "categories": {
      "type": "array",
      "minItems": 1,
      "description": "Product categories of this niche, in display order. 'credit' and 'mixed' are reserved.",
      "items": {
        "type": "object",
        "required": ["id", "label"],
        "properties": {
          "id": { "type": "string", "pattern": "^[a-z0-9-]{2,32}$", "not": { "enum": ["credit", "mixed"] } },
          "label": { "type": "string" },
          "drawing": {
            "enum": ["watch", "smartwatch", "bag-flap", "bag-top", "bag-tote", "bag-pouch", "sneaker", "ring", "bracelet", "pendant", "phone", "laptop", "headphones", "earbuds", "controller", "perfume", "sunglasses", "belt", "scarf", "card", "coin"],
            "description": "Line drawing shown when a product has no photo."
          },
          "showcase": { "type": "boolean", "description": "Show this category's top piece on the home page." }
        }
      }
    },
    "themeColor": {
      "type": "object",
      "required": ["dark", "light"],
      "description": "Browser toolbar colour on phones, per mode.",
      "properties": { "dark": { "type": "string" }, "light": { "type": "string" } }
    },
    "theme": {
      "type": "object",
      "required": ["dark", "light"],
      "description": "CSS colour tokens. 'dark' is the base; 'light' overrides it in light mode.",
      "properties": {
        "dark": { "type": "object", "propertyNames": { "pattern": "^--[a-z0-9-]+$" }, "additionalProperties": { "type": "string" } },
        "light": { "type": "object", "propertyNames": { "pattern": "^--[a-z0-9-]+$" }, "additionalProperties": { "type": "string" } }
      }
    }
  }
}
